{
  "$id": "https://github.com/minsago-elite/decomp_thing/oracle/full-tree-function-observations.schema.json",
  "$schema": "https://json-schema.org/draft/2020-12/schema",
  "additionalProperties": false,
  "properties": {
    "counts": {
      "additionalProperties": false,
      "properties": {
        "emittedRvas": {
          "minimum": 0,
          "type": "integer"
        },
        "nonEmitted": {
          "minimum": 0,
          "type": "integer"
        },
        "nonEmittedDies": {
          "minimum": 0,
          "type": "integer"
        },
        "scannedDies": {
          "minimum": 1,
          "type": "integer"
        },
        "units": {
          "minimum": 1,
          "type": "integer"
        }
      },
      "required": [
        "emittedRvas",
        "nonEmitted",
        "nonEmittedDies",
        "scannedDies",
        "units"
      ],
      "type": "object"
    },
    "emitted": {
      "items": {
        "additionalProperties": false,
        "properties": {
          "aliases": {
            "items": {
              "$ref": "#/$defs/alias"
            },
            "minItems": 1,
            "type": "array"
          },
          "id": {
            "pattern": "^function-rva-0x(?:0|[1-9a-f][0-9a-f]{0,15})$",
            "type": "string"
          },
          "declarations": {
            "items": {
              "$ref": "#/$defs/declaration"
            },
            "minItems": 1,
            "type": "array",
            "uniqueItems": true
          },
          "ownerUnitIds": {
            "items": {
              "$ref": "#/$defs/unitId"
            },
            "minItems": 1,
            "type": "array",
            "uniqueItems": true
          },
          "rva": {
            "$ref": "#/$defs/address"
          }
        },
        "required": [
          "aliases",
          "declarations",
          "id",
          "ownerUnitIds",
          "rva"
        ],
        "type": "object"
      },
      "type": "array"
    },
    "nonEmitted": {
      "items": {
        "additionalProperties": false,
        "properties": {
          "aliases": {
            "items": {
              "$ref": "#/$defs/alias"
            },
            "minItems": 1,
            "type": "array"
          },
          "dieOffsets": {
            "type": "array", "minItems": 1, "uniqueItems": true,
            "items": {
              "type": "object", "additionalProperties": false,
              "required": ["unitId", "dieOffset"],
              "properties": {"unitId": {"$ref": "#/$defs/unitId"}, "dieOffset": {"$ref": "#/$defs/address"}}
            }
          },
          "declaration": {
            "$ref": "#/$defs/declaration"
          },
          "id": {
            "pattern": "^non-emitted-observation-[0-9a-f]{32}$",
            "type": "string"
          },
          "reasonCodes": {
            "type": "array", "minItems": 1, "maxItems": 2, "uniqueItems": true,
            "items": {"enum": ["inline-no-emitted-range", "definition-no-emitted-range"]}
          },
          "unitIds": {
            "type": "array", "minItems": 1, "uniqueItems": true,
            "items": {"$ref": "#/$defs/unitId"}
          }
        },
        "required": [
          "aliases",
          "declaration",
          "dieOffsets",
          "id",
          "reasonCodes",
          "unitIds"
        ],
        "type": "object"
      },
      "type": "array"
    },
    "oracle": {
      "additionalProperties": false,
      "properties": {
        "configurationSha256": {
          "$ref": "#/$defs/sha256"
        },
        "inventoryIndexSha256": {
          "$ref": "#/$defs/sha256"
        },
        "richArtifactSha256": {
          "$ref": "#/$defs/sha256"
        },
        "scopeSha256": {
          "$ref": "#/$defs/sha256"
        }
      },
      "required": [
        "configurationSha256",
        "inventoryIndexSha256",
        "richArtifactSha256",
        "scopeSha256"
      ],
      "type": "object"
    },
    "schemaVersion": {
      "const": 1
    },
    "shard": {
      "additionalProperties": false,
      "properties": {
        "id": {
          "pattern": "^[a-z0-9]+(?:-[a-z0-9]+)*$",
          "type": "string"
        },
        "inputSha256": {
          "$ref": "#/$defs/sha256"
        }
      },
      "required": [
        "id",
        "inputSha256"
      ],
      "type": "object"
    }
  },
  "required": [
    "counts",
    "emitted",
    "nonEmitted",
    "oracle",
    "schemaVersion",
    "shard"
  ],
  "title": "Full-tree DWARF function observation shard",
  "type": "object",
  "$defs": {
    "address": {
      "pattern": "^0x(?:0|[1-9a-f][0-9a-f]{0,15})$",
      "type": "string"
    },
    "alias": {
      "additionalProperties": false,
      "properties": {
        "evidence": {
          "items": {
            "additionalProperties": false,
            "properties": {
              "kind": {
                "const": "dwarf-subprogram"
              },
              "locator": {
                "maxLength": 16384,
                "minLength": 1,
                "type": "string"
              },
              "unitId": {
                "$ref": "#/$defs/unitId"
              }
            },
            "required": [
              "kind",
              "locator",
              "unitId"
            ],
            "type": "object"
          },
          "minItems": 1,
          "type": "array",
          "uniqueItems": true
        },
        "name": {
          "maxLength": 16384,
          "minLength": 1,
          "type": "string"
        }
      },
      "required": [
        "evidence",
        "name"
      ],
      "type": "object"
    },
    "declaration": {
      "additionalProperties": false,
      "properties": {
        "column": {
          "oneOf": [
            {
              "minimum": 0,
              "type": "integer"
            },
            {
              "type": "null"
            }
          ]
        },
        "externalPathSha256": {
          "oneOf": [
            {
              "$ref": "#/$defs/sha256"
            },
            {
              "type": "null"
            }
          ]
        },
        "fileIndex": {
          "oneOf": [
            {
              "minimum": 0,
              "type": "integer"
            },
            {
              "type": "null"
            }
          ]
        },
        "line": {
          "oneOf": [
            {
              "minimum": 0,
              "type": "integer"
            },
            {
              "type": "null"
            }
          ]
        },
        "sourcePath": {
          "oneOf": [
            {
              "maxLength": 4096,
              "minLength": 1,
              "type": "string"
            },
            {
              "type": "null"
            }
          ]
        },
        "unitSourcePath": {
          "maxLength": 4096,
          "minLength": 1,
          "type": "string"
        }
      },
      "required": [
        "column",
        "externalPathSha256",
        "fileIndex",
        "line",
        "sourcePath",
        "unitSourcePath"
      ],
      "type": "object"
    },
    "sha256": {
      "pattern": "^[0-9a-f]{64}$",
      "type": "string"
    },
    "unitId": {
      "pattern": "^cu-[0-9a-f]{32}$",
      "type": "string"
    }
  }
}
